{
  "blocking_count": 0,
  "canonical_findings_reference": "outputs/security/findings/deduplicated-findings.json",
  "counts_by_severity": {
    "CRITICAL": 0,
    "HIGH": 44,
    "LOW": 0,
    "MEDIUM": 0,
    "UNKNOWN": 0
  },
  "execution_status": "completed",
  "finding_count": 44,
  "image_digest": "sha256:4cf7c5e4472e227388bb9fed5b87781bc1b8d0833dc699edce96f3116bee28ec",
  "image_reference": "genomic-research-access-api:git-7bc2106054f197fdd432ce11412aede926764812",
  "policy_outcome": "pass",
  "raw_evidence_reference": "outputs/security/appsec/raw/trivy.json",
  "raw_evidence_sha256": "3dd4e9e9dba89ea2f3670d1c0a711416769ce62a79cd96f14b80552712891283",
  "scanner": "Trivy",
  "scanner_version": "Version: 0.72.0",
  "schema_version": "1.0",
  "suppressed_count": 0
}
